{
  "$schema": "https://json-schema.org/draft/2020-12/schema",
  "$id": "https://peezy-tech.github.io/jaeger/schemas/jaeger.module.schema.json",
  "title": "Jaeger module registry item",
  "type": "object",
  "additionalProperties": false,
  "required": ["schemaVersion", "name", "files", "dependencies"],
  "properties": {
    "$schema": {
      "type": "string"
    },
    "schemaVersion": {
      "const": 1
    },
    "name": {
      "type": "string",
      "pattern": "^[a-z0-9](?:[a-z0-9._-]{0,62}[a-z0-9])?$"
    },
    "title": {
      "type": "string",
      "minLength": 1
    },
    "description": {
      "type": "string",
      "minLength": 1
    },
    "files": {
      "type": "array",
      "minItems": 1,
      "uniqueItems": true,
      "items": {
        "type": "string",
        "minLength": 1
      }
    },
    "dependencies": {
      "type": "object",
      "additionalProperties": {
        "type": "string",
        "minLength": 1
      }
    },
    "requires": {
      "type": "object",
      "additionalProperties": {
        "type": "string",
        "minLength": 1
      }
    },
    "configuration": {
      "type": "array",
      "items": {
        "type": "object",
        "additionalProperties": false,
        "required": ["name"],
        "properties": {
          "name": {
            "type": "string",
            "minLength": 1
          },
          "required": {
            "type": "boolean"
          },
          "secret": {
            "type": "boolean"
          },
          "description": {
            "type": "string",
            "minLength": 1
          }
        }
      }
    },
    "declaredAccess": {
      "type": "object",
      "additionalProperties": {
        "type": "array",
        "items": {
          "type": "string"
        }
      }
    },
    "commands": {
      "type": "object",
      "additionalProperties": {
        "type": "string",
        "minLength": 1
      }
    }
  }
}
